,subreddit,title
782,politics,Texas Democrats Walk Off House Floor to Block Voter Suppression Bill
783,politics,'Democracy itself is in peril:' Biden delivers warning while honoring fallen service members on Memorial Day
784,politics,Texas is the latest frontier in the voting rights fight
785,politics,"Texas Democrats leave House floor, effectively blocking passage of restrictive voting bill for now"
786,politics,"Israel's (possibly) next Prime Minister Bennett: 'When Palestinians were climbing trees, we already had a Jewish state'"
787,politics,Biden defends Americans right to vote 'freely' in Memorial Day remarks
788,politics,"The ""What happened in your state last week?"" Megathread, Week 22"
789,politics,How the Texas voting bill would have created hurdles for voters of color
790,politics,Remarks by President Biden Addressing Service Members and their Families
791,politics,Biden Aims to Rebuild and Expand Legal Immigration
792,politics,Beto O'Rourke breaks down how Republican election laws in Texas are designed to suppress Black and Latino votes
793,politics,New Year Resolution
794,politics,Refer Mismatched Mail Ballot Signatures to Prosecutors - Turning simple signature issues into a potential criminal matter would discourage people from voting
795,politics,Critical race theory is under attack
796,politics,Ep 161) is Biden's Numerous Dumpster Fires Created on Purpose?
797,politics,Biden commemorates war dead at Arlington National Cemetery
798,politics,"Trump-loving church that uses guns in holy rituals buys compound near Waco, Texas"
799,politics,Question for Denmark: Why could the US allegedly eavesdrop?
800,politics,West Virginia Gov. Jim Justice is reportedly on the hook for $700 million in loans from collapsed lender Greensill
801,politics,West Virginia Gov. Jim Justice Is Personally Liable for $700 Million in Greensill Loans
802,politics,Brands Cut Ties With Nashville Hat Shop That Advertised Anti-Vaxxer Star Of David Patches
803,politics,Rep. Jeffries: Texas voting law a 'shameful' part of voter suppression epidemic
804,politics,Russia tells U.S. to expect ‘uncomfortable’ signals ahead of Putin-Biden summit
805,politics,"Texas Democrats abandon House floor, blocking passage of voting bill before final deadline"
806,politics,White House gives GOP 1 week to reach deal on infrastructure
807,politics,Homicides: USA vs EU
808,politics,Democracy vouchers play crucial role as candidates compete for cash in Seattle mayoral race
809,politics,‘Looks like she’s 19’: Uproar after Biden’s remarks about girl at Virginia military base
810,politics,Majority in poll say discrimination against Asian Americans is worse than a year ago
811,politics,Reddit politics is nothing more than crazy liberals spouting conspiracy theories and disinformation.
812,politics,Creepy Joe
813,politics,Creepy Joe the Pedo.
814,politics,"Now I understood how to live in ""The Terminal"" movie feels."
815,politics,Instagram changes algorithm after accusations of censoring pro-Palestinian content
816,politics,The Republican Party's Delusional Attachment to Trump Sets the Stage for the Acceleration of Neoliberal Proto-Fascism
817,politics,"US should have coup like Myanmar, former Trump advisor Michael Flynn tells QAnon conference in Texas"
818,politics,"Justice Department to boost resources to fight hate crimes, attorney general says"
819,politics,Founder of Black Lives Matter chapter reveals he left org after learning 'the ugly truth' about BLM
820,politics,"Texas Democrats Walk Out, Block GOP’s Sweeping Voting Restrictions Bill for Now"
821,politics,How Bad a President Was Trump?
822,politics,"Sorry, Republicans: Joe Biden isn’t Jimmy Carter — and these aren’t the 1970s"
823,politics,Idaho governor hits out at ‘abuse of power’ by lieutenant governor for her ban on mask mandates while he was away
824,politics,The UK Has Wasted 50 Years Fighting a Losing War on Drugs
825,politics,Cruise lines and Florida Gov. DeSantis square off over vaccine passports
826,politics,"Pentagon chief fires back at Sen. Ted Cruz, says U.S. military will never be 'soft'"
827,politics,The GOP Only Cares About the Debt Ceiling When Spending Goes Toward the People
828,politics,The White House want investors to ‘dogecoin to their heart’s content’
829,politics,Euterpe
830,politics,The US reportedly spied on Angela Merkel and other top European politicians with Denmark's help
831,politics,Mitch will never be as great as John Sherman Cooper at the rate he's going.
832,politics,Texas Democrats block restrictive voting bill by walking off the floor to deny GOP-majority House a quorum
833,politics,"If Trump Vanished, Few Republicans Would Look For Him, Quips Ex-GOP Rep. Barbara Comstock"
834,politics,Suicide Rates Spike for ICE Detainees
835,politics,"In the Battle over Bitcoin, It’s Bull vs. Bear in Elon Musk’s Brain"
836,politics,13 52
837,politics,Texas’ fix after blackout doesn’t dwell on climate change
838,politics,But muh rEstRiCtiVe voting laws attempting to be passed. Meanwhile in Democrat controlled Colorado 🤡🤯
839,politics,"Sidney Powell claims Trump ""can simply be reinstated,"" Biden told to leave White House"
840,politics,Sidney Powell Loses It And Demands That Trump Be Reinstated To The White House
841,politics,The Next Prime Minister of Israel Believes the Bible justifies ethnic cleansing
842,politics,Gaetz’s GOP Primed Young Women to Sell Sex to Men Like Him
843,politics,"Cruise Ships, Florida’s DeSantis Clash over Vaccine Passports"
844,politics,Geek Squad tech support | Geek Squad online Support
845,politics,"Texas Democrats Block Harsh Voting Bill By Walking Out En Masse - The bill would crack down on absentee voting, drive-through voting and more — and Texas Republicans could still pass it."
846,politics,The Next Prime Minister of Israel Believes the Bible Justifies Ethnic Cleaning
847,politics,Trump’s Ex-National Security Adviser Michael Flynn Calls For Myanmar-Type Coup In U.S.
848,politics,"For Democrats, GOP filibuster of Jan. 6 commission tests ‘limits of bipartisanship’"
849,politics,"Fuck Alex Zhao, he took everything from me. I am homeless and jobless because of this rat."
850,politics,Illinois bill bans police from lying during questioning
851,politics,A Right to Affordable Fertility Treatment
852,politics,The Effort To Reform The U.S. Military's Justice System Faces A New Fight
853,politics,Ex-National Security Advisor Mike Flynn Tells QAnon Conference That a Coup Like The One In Myanmar ‘Should Happen’ in The US
854,politics,Matt Gaetz says $155k to close on yacht with his fiancee ‘went missing’
855,politics,Republicans Fear That Donald Trump May Wreck Their Chances to Fulfill His Darkest Fantasies
856,politics,"Fauci warns U.S. not to declare ""victory"" prematurely and ""abandon"" COVID rules"
857,politics,"'Not a Republican, Just Vaccinated' Pins, T-Shirts Sold on Etsy"
858,politics,Michael Flynn Says Coup Like in Myanmar 'Should Happen' in America
859,politics,Video reveals Michael Flynn calling for coup like 'what happened in Myanmar' to replace Biden with Donald Trump
860,politics,"Texas Democrats abandon House floor, blocking passage of voting bill before final deadline"
861,politics,VER-ONICA VICT-ORIA NUDE TWERKING VIDEO
862,politics,Juan Williams: GOP extremism is poisoning the nation
863,politics,Lies about Trump are more important than telling the truth to Americans.
864,politics,Death of QAnon Follower at Capitol Leaves a Wake of Pain
865,politics,"Repairing America: Exploring Fight for Reparations, Racial Justice Across the Country"
866,politics,AIs from AI Dungeon 2 to sexy to funny and one based wholly on Reddit!
867,politics,"Former Trump advisor Michael Flynn said the US should have a coup like Myanmar, where the military overthrew the democratically elected government"
868,politics,"As pandemic wanes, Florida’s DeSantis seizes national stage"
869,politics,P
870,politics,Biden received funds from Russia lobbyist before conceding on major pipeline: Report
871,politics,[OC] Dwayne The Rock Johnson for President? I offer a response to Bill Maher's recent ridiculing of The Rock. Very keen for some feedback and thoughts. Cheers fellas
872,politics,Gaetz’s GOP Primed Young Women to Sell Sex to Men Like Him
873,politics,"Texas Democrats Walk Off House Floor to Block 'One of the Ugliest Voter Suppression Bills in the Country' | ""This is the kind of fight we need from our legislators."""
874,politics,How Young G.O.P. Leaders Sold Out Their Generation
875,politics,Fuck commies
876,politics,Texas Democrats block restrictive voting bill by walking off the floor to deny GOP-majority House a quorum
877,politics,Trump blasts Biden for ‘destroying our country’ with border decisions
878,politics,Federal judges call for increased security after threats jump 400% and one judge's son is killed
879,politics,9 Republicans not named Trump who could run in 2024
880,politics,"Dems walk, stop Texas GOP's sweeping voting restrictions"
881,politics,7 Countries with the Best Work-Life Balance
882,politics,"Columna Vía Libre La diferencia entre fifi y chairo, no está en el dinero que tenga la gente sino en la idiosincrasia de los chihuahuenses; el cierre de campaña de los candidatos del PAN, encabezado por Maru Campus y Marco Bonilla, el cual se llevó a cabo en el estacionamiento del estadio de"
883,politics,Shadow primary: GOP 2024 hopefuls dive into House races to get around Trump
884,politics,State of Arizona to begin using Zyklon B to execute inmates on death row
885,politics,Ex-Trump adviser Michael Flynn says Myanmar-like coup ‘should happen’ in U.S
886,politics,Dan Bongino
887,politics,Four more indicted in alleged Jan. 6 Oath Keepers conspiracy to obstruct election vote in Congress
888,politics,"Dems walk, stop Texas GOP's sweeping voting restrictions"
889,politics,"Texas Democrats Walk Out, Stop Republican's Sweeping Voting Restrictions"
890,politics,"117 Employees Sue Houston-Area Hospital Over Vaccine Mandate, 'You're Forcing Us to Be Human Guinea Pigs'"
891,politics,White House cranks up the pressure as infrastructure talks drag on
892,politics,Veer Savarkar ji : a sanatani warrior.
893,politics,"Texas Democrats stage walkout over restrictive voting bill, killing it for now"
894,politics,ECOWAS suspends Mali over Coup d'état
895,politics,"Capitol Hill rioter ‘QAnon Shaman’ to argue he was brainwashed by online cult, as lawyer plans ‘dumbass’ defence"
896,politics,"It's like: As a Landlord, I keep getting more income from renters. While they stay at the same level of income. Thanks Biden!"
897,politics,Vote on Texas bill to make voting tougher blocked by no quorum
898,politics,AIs from AI Dungeon 2 to sexy to funny and one based wholly on Reddit!
899,politics,"Return of the Mack ""New"" 2021"
900,politics,Michael Flynn asks for violent military coup
901,politics,"Denmark helped NSA spy on Merkel &amp; other European leaders, new reports reveal, as Snowden says Biden was ‘deeply involved’ — RT World News"
902,politics,"Texas Democrats stage walkout to stop debate on restrictive voting bill, delaying final passage"
903,politics,"Michael Flynn says coup like in Myanmar ""should happen"" in America"
904,politics,Michael Flynn Says Coup Like in Myanmar 'Should Happen' in America
905,politics,"NSA spying row: Denmark helped US gather data on European officials, says report"
906,politics,"Texas Democrats stage walkout over restrictive voting bill, killing it for now"
907,politics,Texas Democrats’ late-night walkout scuppers Republican efforts to restrict voting rights
908,politics,"Texas Democrats Stymie G.O.P. Voting Bill, for Now"
909,politics,Texas Democrats Block Harsh Voting Bill By Walking Out En Masse
910,politics,Cannabis Rumors On Capitol Hill
911,politics,"Dems walk, stop Texas GOP's sweeping voting restrictions"
912,politics,Whats going on with these presidents??!!!!
913,politics,"Biden marks son Beau's death with grave visit, remarks to military families"
914,politics,Vote on Texas bill to make voting tougher blocked by no quorum
915,politics,"Texas Democrats leave House floor, effectively blocking passage of restrictive voting bill for now"
916,politics,Texas Democrats leave House floor in attempt to block voter restriction bill
917,politics,"Texas Democrats walk out, keep sweeping voting curbs bill from passing"
918,politics,"What's point / creating a post? My opinion is considered ""too new"" because I've only recently joined Reddit. But U can chew on THIS FACT: I have participated in EVERY AUDIT / Maricopa Co. ballots since law passed 2006; DONALD J. TRUMP LOST AZ! MINE is ""expert opinion"" &amp; YOUR ""older"" opinions R crap."
919,politics,"Dems walk, stop Texas GOP's sweeping voting restrictions"
920,politics,Four more Oath Keepers indicted in Jan. 6 federal conspiracy case: court filing
921,politics,Support for new proposed law to boost whistleblowers at Veterans Affairs
922,politics,Department of Veterans Affairs oversight body highlights $2.6B IT overspend
923,politics,"Texas Democrats stage walkout to stop debate on restrictive voting bill, delaying final passage"
924,politics,Texas Democrats abandon House floor in attempt to block voting bill
925,politics,"Texas Democrats leave House floor, effectively blocking passage of restrictive voting bill for now"
926,politics,"Texas Democrats Stymie G.O.P. Voting Bill, for Now"
927,politics,Texas Democrats abandon House floor in attempt to block voting bill
928,politics,"Texas Democrats Stymie G.O.P. Voting Bill, for Now"
929,politics,Why The U.S. Thinks A Lab In Wuhan Needs A Closer Look As A Possible Pandemic Source
930,politics,Texas Democrats block restrictive voting bill from being approved by walking off the floor to deny GOP-majority House a quorum.
931,politics,"Texas Democrats leave House floor, effectively blocking passage of restrictive voting bill for now"
932,politics,Covid Live Updates: U.S. Experts See Urgent Need for New Search of Pandemic’s Origins
933,politics,"Texas Democrats Stymie G.O.P. Voting Bill, for Now"
934,politics,Texas Democrats block restrictive voting bill from being approved by walking off the floor to deny GOP-majority House a quorum
935,politics,"Texas Democrats Stymie G.O.P. Voting Bill, for Now"
936,politics,Sex workers gain foothold in Congress
937,politics,Outspoken Republican Who Opposes Legalization Owns Quite a Lot of Stock in Pot
938,politics,VIDEO: Former BLM Leader Says He ‘Learned the Ugly Truth’ About the Organization
939,politics,"Nikki Haley tweets that Kamala Harris is ""Unprofessional and unfit."" for saying ""Enjoy the long weekend""..and doesn't see the irony or hypocrisy"
940,politics,Republicans appeased the extremists -- and now they're paying the price
941,politics,"Comstock: If Trump Went Missing, Few in GOP Would Be in 'Search Party'"
942,politics,"Ciudad de México.- El Cruz Azul se coronó campeón de la Liga MX, rompiendo de esta manera una racha de 23 años sin levantar el título, luego de vencer al Santos. Aunque ambos equipos empataron a 1 enel Estadio Azteca, la victoria conseguida en el partido de ida, fue suficiente para que con un"
943,politics,Judge Joe Brown Claims Joe Biden Called Black Children “roaches” And Much Worse!
944,politics,Republicans are calling for a violent military coup
945,politics,More QAnon craziness in Dallas
946,politics,"Invitan a defender la democracia el próximo 6 de junio Este domingo, los candidatos del Partido Acción Nacional (PAN) a presidente municipal y diputado local, Marco Bonilla y Mario Vázquez respectivamente, realizaron cierre de campaña del Distrito 16 en la colonia Dale, acompañados por"
947,politics,Flynn calls for a violent coup like Myanmar's
948,politics,Russia Brings Back The Gulag
949,politics,Is America’s Democracy Slipping Away?
950,politics,"Former GOP Rep. Barbara Comstock: If Trump went missing, not many Republicans would be 'in the search party'"
951,politics,"23,000 online with 7.6 million members"
952,politics,Trump's Ex-National Security Adviser Michael Flynn Calls For Myanmar-Type Coup In U.S.
953,politics,Americans demand court-martial for Flynn after call for military coup: 'Honor veterans — arrest this traitor'
954,politics,Ex-Trump adviser Michael Flynn says Myanmar-like coup ‘should happen’ in U.S.
955,politics,Fake GOP Outrage As Kamala Harris Tells Americans To ‘Enjoy The Long Weekend’ For Memorial Day
956,politics,Devin Dunham who admits to killing 77 year old Martin Stevens in 2017 and is ruled as not guilty.
957,politics,Scoop: White House considering fast-track family deportations
958,politics,N.J. has a tense race for Republican nod to challenge Gov. Murphy. Here are the 4 candidates.
959,politics,Trump's longtime ally Roger Stone has warned that the former president must prepare to be indicted for fraud in the coming weeks
960,politics,"U.S. security agency spied on Merkel, other top European officials through Danish cables"
961,politics,Biden received funds from Russia lobbyist before conceding on major pipeline: Report
962,politics,Ex-Trump adviser Michael Flynn says Myanmar-like coup ‘should happen’ in U.S.
963,politics,New defendants charged in Oath Keepers conspiracy case
964,politics,Biden might make it easier to swiftly deport migrant families
965,politics,Mary Feo on Twitter
966,politics,Ex-Trump adviser Michael Flynn says Myanmar-like coup ‘should happen’ in U.S.
967,politics,Biden’s behind-the-scenes approach to the Israel/Gaza problem was an effective approach
968,politics,Illinois approves ban on police deception in juvenile interrogations
969,politics,NAACP Pledges Immediate Lawsuit Over Texas Voter Suppression Bill
970,politics,Joe Biden’s presidency What America thinks
971,politics,"Dr. Sellin’s explanation on the origin of COVID-19, the CCP’s military biological warfare plan, military-civilian integration and other projects."
972,politics,Jim Crow Joe is still as racist as ever to allow this to be happening in America...😠
973,politics,Supreme court justice Stephen Breyer: Democrats must ‘get Republicans talking’
974,politics,Video reveals Michael Flynn calling for coup like 'what happened in Myanmar' to replace Biden with Donald Trump
975,politics,"If this is indeed the end of the Netanyahu era, he has his supporters to blame"
976,politics,Israeli far-right leader Bennett joins anti-Netanyahu coalition
977,politics,Caroline Kennedy in running to be named US ambassador to Australia: report
978,politics,"Former Trump advisor Michael Flynn said the US should have a coup like Myanmar, where the military overthrew the democratically elected government"
979,politics,Man who told police he fatally shot ex-Hardeeville fire chief in 2017 found not guilty
980,politics,Texas Voting Bill Nears Passage as Republicans Advance It
981,politics,Unbelievable...😠
982,politics,Sickening...
983,politics,Texas G.O.P. Races to Pass Voting Bill as Pressure on Democrats Rises
984,politics,origins of virus
985,politics,"Diblasio's New York, arent you proud ?"
986,politics,Look What Has Been Taken From Black Americans
987,politics,The truth about Gropey ole'Joe...
988,politics,got my political results back!
989,politics,(VIDEO) Armed Black Supremacists in Tulsa: 'There Will Come a Time When We Will Kill Everything White in Sight'
990,politics,Explainer: How Texas Republicans aim to make voting harder
991,politics,SAIBA A VERDADE SOBRE O DEBATE DE CAIO COPOLLA E KIM KATAGUIRI! DEPUTADO...
992,politics,Israeli opposition parties reach agreement to oust Prime Minister Benjamin Netanyahu
993,politics,"'Wait, What?': Elon Musk Claims Dinosaurs 'would Still Be Around If They Had Spaceships'"
994,politics,California Congresswoman reveals she sleeps with gun by her bed after death threats
995,politics,Gillibrand Calls on Schumer to Bring Bipartisan Military Sexual Assault Bill to Floor
996,politics,Did Biden really beat Trump? And who regrets voting for Biden?
997,politics,How plant-based diets could help prevent the next COVID-19
998,politics,Sidney Powell says Trump 'can simply be reinstated'
999,politics,"A rogue killer drone 'hunted down' a human target without being instructed to, UN report says"
1000,politics,Altercation: Why Journalism Isn’t Really Covering the Threat of Fascism - The American Prospect
1001,politics,Barbara Comstock: If Trump disappeared there wouldn't be many Republicans in the search party | TheHill
1002,politics,"American Democracy Isn’t Dead Yet, but It’s Getting There | The New Yorker"
1003,politics,Extent of Elon Musk's influence on cryptocurrency; where is it headed?
1004,politics,"Armed marchers take to downtown Tulsa streets in show of strength, solidarity in honor of Race Massacre victims"
1005,politics,"Media spread fear, Americans listen | TheHill"
1006,politics,J.D. Vance emerges as wild card in Ohio GOP Senate primary | TheHill
1007,politics,"Watch now: Armed marchers take to downtown Tulsa streets in show of strength, solidarity in honor of Race Massacre victims"
1008,politics,The sacrifices of the fallen can remind us we must work together to heal the divisions among us | TheHill
1009,politics,Tulsa Massacre and a case for reparations: 5 Things podcast
1010,politics,"Rep. Michael McCaul, top Republican on House Foreign Affairs Committee, calls Covid-19 origin 'worst cover-up in human history' - CNNPolitics"
1011,politics,Gillibrand calls on Schumer to bring vote on bill to change how military sexual assault cases are prosecuted
1012,politics,Can employers require COVID vaccine? EEOC says vaccination rules OK
1013,politics,White House gives GOP 1 week to reach deal on infrastructure
1014,politics,Four more journalists get felony charges after covering inauguration unrest | Media | The Guardian
1015,politics,White House gives GOP 1 week to reach deal on infrastructure
1016,politics,9 Senate seats most likely to flip in 2022 | TheHill
1017,politics,A bipartisan January 6 commission failed to pass the Senate. Democrats will now try for a House select committee instead. - Vox
1018,politics,Sicknick's girlfriend: GOP decision to block Jan. 6 commission 'speaks volumes' | TheHill
1019,politics,Explainer: How Texas Republicans aim to make voting harder
1020,politics,GOP introduces Bill to Ban BLM flag and other political flags from being flown at US embassies
1021,politics,Hundreds of black gun owners take part in 2nd Amendment Armed March
1022,politics,Special House election measures political pulse after Trump - ABC News
1023,politics,Over 100 staff sue Houston Methodist over COVID-19 vaccine requirement | TheHill
1024,politics,Hat makers distance from Nashville store amid uproar over 'not vaccinated' badges | TheHill
1025,politics,"Eric Riddick, released after serving 29 years for crime he says he didn't commit, turns focus to helping others - ABC News"
1026,politics,Secret Chats Show How Cyber Ninjas Became a Ransomware Powerhouse - The New York Times
1027,politics,Nashville hat shop hawks anti-vaccine yellow Star of David badge
1028,politics,Protesters surround Nashville hat store after Star of David post - New York Daily News
1029,politics,California DA not seeking death sentence for Scott Peterson - New York Daily News
1030,politics,Calls Mount for Biden to Form Presidential 1/6 Commission After GOP's 'Cowardly Filibuster'
1031,politics,U.S. Cases Drop by Half in May; India Passes Peak: Virus Update
1032,politics,Biden's authority to cancel student debt remains to be seen as forbearance comes to close
1033,politics,"GOP Lawmaker Likens Sex Education to Porn, Blames Lack of Independent Legislative Maps"
1034,politics,The Senate GOP wants to divert stimulus money for infrastructure - but the White House says it will come at the expense of restaurants and hospitals
1035,politics,404: No broadband found; rural areas suffer from lack of access
1036,politics,Sex trafficking probe into Congressman Matt Gaetz may turn to ex-girlfriend
1037,politics,"NSA spying row: Denmark helped US gather data on European officials, says report"
1038,politics,Fact check: False claim from Trump about Maricopa County election data
1039,politics,Fact check: True claim about Supreme Court and vaccination
1040,politics,'Baloney': Deceased Capitol Cop Brian Sicknick's Girlfriend and Mom Slam GOP Over Riot Commission
1041,politics,"Homan Square revealed: how Chicago police 'disappeared' 7,000 people | Homan Square | The Guardian"
1042,politics,The DNC didn’t get hacked in 2020. Here’s why.
1043,politics,How to get more rural kids to college? Universal broadband would help | TheHill
1044,politics,Scrambling Trump torches GOP for not backing his election lies
1045,politics,‘Assault on democracy’: Biden torches Texas voting bill - POLITICO
1046,politics,Towards A Real Democratic Majority
1047,politics,California Prosecutor Will Not Seek a New Death Sentence for Scott Peterson
1048,politics,Rebekah Jones’s New ‘Whistleblower’ Claim Is Merely the Latest in a Long Line of Tricks
1049,politics,China and espionage industry
1050,politics,"Oklahoma governor bars state agencies from mandating masks, vaccines | TheHill"
1051,politics,Texas pension bill plays politics with retirees' money | TheHill
1052,politics,Ex-cop hired to probe Wisconsin election has partisan ties | Wisconsin Elections | madison.com
1053,politics,Opinion | The really scary reason Republicans don’t want to face the truth about Jan. 6 - The Washington Post
1054,politics,"'We are facing a student loan time bomb,' Senator Warren says amid $50,000 forgiveness push"
1055,politics,The Memo: Marjorie Taylor Greene exposes GOP establishment's lack of power | TheHill
1056,politics,Biden called ‘creepy’ after attempting to compliment young girl by saying she ‘looks 19’
1057,politics,Texas state lawmakers finalize new voting restrictions bill | TheHill
