,subreddit,title
1591,politics,The Insurrection Isn’t Over | The Republican Party is increasingly in thrall to the myth that propelled the insurrection. What next?
1592,politics,Biden blasts Texas voting bill: 'An assault on democracy'
1593,politics,Trump Case: New York Prosecutor Known for Aggressive Pursuit of Evidence
1594,politics,Vice President Kamala Harris under fire for 'disrespectful' tweet
1595,politics,"Court Strikes Down Racial, Gender Preferences In Biden’s $1.9 Trillion Covid Relief Bill That Discriminated Against Restaurant Owners"
1596,politics,Critical race theory ban leads Oklahoma college to cancel class that taught ‘white privilege’
1597,politics,"Federal judge refuses to block restaurant aid priority for women, minorities"
1598,politics,URGENTE! VAZOU ÁUDIO DE POLICIAL QUE FEZ ESCOLTA DE BOLSONARO NA MOTOCIATA
1599,politics,White House asks court to dismiss lawsuit over drug imports
1600,politics,Crackpipe Hunter
1601,politics,Tulsa 'Remember and Rise' event canceled days before centennial of race massacre after dispute over payment to survivors
1602,politics,"Bill Maher defends Israel, rips 'liberal media' and 'Bella Hadids of the world'"
1603,politics,'Creepy Joe' strikes again: President Biden is slammed for singling out 'elementary school-aged' girl during speech and saying 'she looks like she's 19 years old'
1604,politics,The Daily Beast: 'Florida's Worst Cop' Was Just Fired for Misconduct—for the Seventh Time.
1605,politics,US Jews Are Increasingly Breaking With Israel to Support Palestinian Liberation
1606,politics,Countries around the world are racing to deliver COVID-19 Vaccine
1607,politics,Special House election measures political pulse after Trump
1608,politics,Log into Facebook
1609,politics,"Biden’s $6 trillion budget: Social spending, taxes on business"
1610,politics,Meet the anti-legalization GOP Congresswoman cashing in on marijuana stocks
1611,politics,‘Little lady with her legs crossed’: Biden gives a shoutout at military family event
1612,politics,Texas Republicans Finalize Major Bill of Voting Limits
1613,politics,Billionaire Elon Musk was charged with 2nd Degree Felony Assault this Saturday Morning
1614,politics,"What is critical race theory, and why do Republicans want to ban it in schools?"
1615,politics,U.S. agency says employers can mandate COVID-19 vaccination
1616,politics,Texas pension bill plays politics with retirees' money
1617,politics,"GOP Blocks Capitol Riot Probe, Displaying Loyalty to Trump"
1618,politics,More U.S. states ease lingering virus rules as vaccine rates rise
1619,politics,Billionaire Elon Musk was charged with 2nd Degree Felony Assault this Saturday Morning
1620,politics,Health Canada extends shelf life of AstraZeneca doses set to expire Monday by a month
1621,politics,"GOP blocks Capitol riot probe, displaying loyalty to Trump"
1622,politics,Biden budget drops Hyde Amendment to allow public funding of abortion
1623,politics,Donald Trump Is Allegedly 'Going Berserk' Without The Presidency
1624,politics,Health Canada extends shelf life of AstraZeneca doses set to expire Monday by a month
1625,politics,Presidential Panel on Capitol Riot Sought by Democratic Lawmaker
1626,politics,Sanders Warns That Dragging Out Talks With GOP Could Lose Congress for Dems
1627,politics,I Never Thought This Would Happen In The United States | Rudy Giuliani |...
1628,politics,Cancel ALL student debt - Send a letter to your representative
1629,politics,Swiss Bank Admits to Laundering $36 Million in Bribes to Soccer Officials
1630,politics,"GOP blocks Capitol riot probe, displaying loyalty to Trump"
1631,politics,White House asks court to dismiss lawsuit over drug imports
1632,politics,David Chipman: Law enforcement groups endorse Biden's pick for ATF director ahead of confirmation hearing
1633,politics,Biden ATF nominee Chipman faces Republican Senate scrutiny
1634,politics,Biden pick for ATF pushes back against GOP senators — and disinformation
1635,politics,Winnie the Pooh
1636,politics,How Red Or Blue Is Your State? Your Congressional District?
1637,politics,Billionaire Elon Musk was charged with 2nd Degree Felony Assault this Saturday Morning
1638,politics,Supreme Court: Breyer’s new warning for Democrats comes at the worst possible time
1639,politics,"Republican lawmakers try to limit teaching about race, racism"
1640,politics,How Mitch McConnell killed the US Capitol attack commission
1641,politics,Ammon Bundy And Co. Are Eyeing Another Standoff With Feds In Southern Oregon
1642,politics,"State GOP lawmakers try to limit teaching about race, racism"
1643,politics,Rep. Connolly calls for Biden to create Jan. 6 commission
1644,politics,UK's Boris Johnson weds in 'secret ceremony': reports
1645,politics,How Did New York City Politics Become So Boring?
1646,politics,Tillis votes to block commission to investigate Jan. 6 Capitol riot; Burr doesn’t vote
1647,politics,A bipartisan January 6 commission is probably dead. Democrats have a backup plan. | A House committee could be less vulnerable to GOP obstruction.
1648,politics,Billionaire Elon Musk Charged with 2nd Degree Felony Assault
1649,politics,America’s asylum system is broken. Here’s how Biden could fix it.
1650,politics,Texas Republicans finalize bill that would enact stiff new voting restrictions and make it easier to overturn election results
1651,politics,Family of fallen Capitol Police officer Brian Sicknick slams GOP lawmakers who blocked Jan. 6 commission as 'not backing the blue'
1652,politics,"After repeated ATF warnings, gun dealers can count on the agency to back off; sometimes firearms flow to criminals"
1653,politics,Sicknick's girlfriend: GOP decision to block Jan. 6 commission 'speaks volumes'
1654,politics,Mitch McConnell Is A 'Spineless McWorm' On Damning New York Daily News Cover
1655,politics,Family of fallen Capitol Police officer Brian Sicknick slams GOP lawmakers who blocked Jan. 6 commission as 'not backing the blue'
1656,politics,"As Israel increasingly relies on US evangelicals for support, younger ones are walking away: What polls show"
1657,politics,Opinion: Not a dime’s worth of difference between McConnell and McCarthy
1658,politics,5 Ways Officials Have Cracked Down on Protests Since the Floyd Uprisings
1659,politics,Former DNC Chair Tom Perez Now Works for Anti-Labor Law Firm
1660,politics,"Bill Maher slams celebrities Jenner, McConaughey as having 'malignant narcissism' for seeking jump into politics"
1661,politics,'Wrong and un-American’: Biden blasts Texas Republicans’ voting rights bill
1662,politics,DOJ asks judge to dismiss lawsuit against Trump for protest crackdown before Bible photo op
1663,politics,How an Accused Russian Agent Worked With Rudy Giuliani in a Plot Against the 2020 Election
1664,politics,How Red or Blue is your State?
1665,politics,"How America Went From Mom-and-Pop Capitalism to Techno-Feudalism, by Ellen Brown"
1666,politics,The First Amendment is losing
1667,politics,Donald Trump US seeks dismissal of cases against Trump for clearing Lafayette Square
1668,politics,Fox News Intensifies Its Pro-Trump Politics as Dissenters Depart
1669,politics,Census Bureau's use of 'synthetic data' worries researchers
1670,politics,"CAIR-Florida, Civil Rights and Interfaith Groups Seek Probe of Rep. Randy Fine’s Hateful Posts; Ask Members of Jewish Caucus to Clarify Their Stance"
1671,politics,Masks Didn't Slow COVID Spread: New Study
1672,politics,Majority of Republicans blame non-existent ‘left-wing protesters’ for 6 January Capitol attack: poll
1673,politics,PM Modi announces Stipend for Children Orphaned due to Covid
1674,politics,"Tennessee hat shop blasted for selling Nazi-style Jewish stars proclaiming ""not vaccinated"""
1675,politics,Warren calls for overdraft fee crackdown after blasting Dimon
1676,politics,"DOJ asks judge to dismiss cases against Trump, Barr for Lafayette Square clearing"
1677,politics,"Marjorie Taylor Greene challenger ""kicked out"" of ""America First"" rally in Georgia"
1678,politics,Most U.S. shootings are drug/ gang related and occur in minority neighborhoods
1679,politics,"Texas Attorney General Ken Paxton’s criminal case to be heard in Collin County, appeals court rules"
1680,politics,The Dulce Underground Base: The Deep Dark Secret at Dulce (video) | New World Order | Before It's News
1681,politics,"U.S. government seeks to dismiss suit against Trump, Washington Post says"
1682,politics,"Now that Republicans have killed the commission to investigate the January 6th insurrection, the Democrats should now pursue it as a civil case, as multiple felonies occurred that were openly instigated by numerous Republican politicians, including Trump."
1683,politics,After San Jose shooting: Confirm new ATF chief to police the gun industry and save lives
1684,politics,'Looks like she's 19': Biden remarks about girl at VA military base
1685,politics,‘It’s insane’: Proud Boys furor tests limits of Trump’s GOP
1686,politics,"Capitol rioters will blame Trump, Fox News for their actions on Jan. 6: report"
1687,politics,GOP Sen. Tommy Tuberville Complains About Having To Do His Job
1688,politics,President Joe Biden says Texas voting bill is “part of an assault on democracy”
1689,politics,Texas poised to pass sweeping voting restrictions bill
1690,politics,Come join the End FPTP (First Past the Post) voting Question and Answer session with Mr. Paul Jacob from Citizens in Charge on June 5th 6pm EST
1691,politics,The Ugly Truth: Republicans Want More Poverty and Crime
1692,politics,Hunter Biden bragged about smoking crack with DC Mayor Marion Barry
1693,politics,"These instagram ""models"" are negatively impacting beauty standards. I will never understand why all these Feminist and Mainstream media defend and praise them. What are your thoughts?"
1694,politics,Tech groups sue DeSantis over social media bill
1695,politics,"Return of the Mack ""New"" 2021"
1696,politics,US warns Wisconsin may lose $1.5 billion in pandemic aid under budget action
1697,politics,Our troops need more than a salute this Memorial Day. They need food.
1698,politics,"Lawyers for at least three defendants charged in connection with the Jan. 6 Capitol insurrection say they'll blame election misinformation and conspiracy theories, including those pushed by then-President Donald Trump, for misleading their clients."
1699,politics,Penn. GOP lawmakers pass bill that fines women for miscarriages
1700,politics,"President Joe Biden says Texas voting bill is “part of an assault on democracy” | Senate Bill 7, a Republican priority voting bill, would limit early voting hours, curtail local voting options and further clamp down on mail-in voting, among several other provisions."
1701,politics,"Rep. Crenshaw, Sen. Cotton launch whistleblower effort against military 'woke ideology'"
1702,politics,A faction of conservatives pushes to build its own climate movement
1703,politics,The State of California’s ‘State of Jefferson’
1704,politics,Texas Republicans Finalize Major Bill of Voting Limits
1705,politics,Calls Mount for Biden to Form Presidential 1/6 Commission After GOP's 'Cowardly Filibuster'
1706,politics,We really went from Pregnant Women Shouldn't Drink to Dropping the Hyde Amendment
1707,politics,Gaetz Tells Supporters Second Amendment Is For ‘Armed Rebellion Against The Government’
1708,politics,Texas lawmakers poised to pass sweeping voting bill to restrict voting hours and change election rules
1709,politics,‘Tyranny’: Idaho Gov. Brad Little repeals McGeachin’s ban on mask mandates
1710,politics,Sheriff: Claims against Missouri lawmaker not credible
1711,politics,Three men charged with hate crimes after antisemitic incidents in Brooklyn
1712,politics,White House asks court to dismiss lawsuit over prescription drug imports from Canada
1713,politics,"Police do not support Texas’ ‘constitutional carry’ bill headed to Gov. Greg Abbott’s desk, Miami PD chief says"
1714,politics,Biden Budget Omits Broad Student Loan Forgiveness—Here’s Where Things Stand In Washington On Relief
1715,politics,U.S. fails to intercept test missile target
1716,politics,Texas Republicans finalize bill that would enact stiff new voting restrictions and make it easier to overturn election results
1717,politics,The D.N.C. Didn’t Get Hacked in 2020. Here’s Why.
1718,politics,"Biden accused of 'sickening' comments about young girl, including her legs: 'Looks like she's 19'"
1719,politics,"State Republican lawmakers try to limit teaching about race, racism | Tennessee latest state to ban or limit teaching of ideas linked to 'critical race theory'"
1720,politics,An Arms Race in America: Gun Buying Spiked During the Pandemic. It’s Still Up.
1721,politics,Why do states spend tens of millions each every year on advertising vaccines for the flu when they could just do what West Virginia did and have million dollar cash drawings. It took only 6 hours to reach me here in Minnesota after their governor announced it.
1722,politics,"1,000 Lawyers and 10,000 Doctors Join Together and File Lawsuit to Prosecute the ""2nd Nuremburg Tribunal"" Against Corona Fraud Scandal"
1723,politics,Libtards are morans and their to stupid to except facts that dont sapport there narative cause they dont no anything u should of lisened in school and u would'nt be so dum your ruining are country
1724,politics,"The Republican Party, Racial Hypocrisy, and the 1619 Project"
1725,politics,Republicans Are Passing Laws to Keep Teachers From Talking About Race
1726,politics,'Spineless McWorm': New York Daily News delivers stinging rebuke of Mitch McConnell with mocking nickname
1727,politics,"Gun-friendly Texas had most gun dealer violations in the nation, USA TODAY analysis shows"
1728,politics,It took only 6 hours from the time the governor announced his million dollar cash incentive top prize for Coronavirus vaccines to reach me in Minnesota. Why is each state spending tens of millions of dollars advertising vaccines for the flu when each year they could just give away $1 million dollars
1729,politics,Patrick Byrne: pro-Trump millionaire pushing election conspiracy theories
1730,politics,Republican obstructionism has gone far enough. It's time to do away with the filibuster
1731,politics,Calls Mount for Biden to Form Presidential 1/6 Commission After GOP's 'Cowardly Filibuster'
1732,politics,Rep. Marjorie Taylor Greene broke out a 'really bad Mexican accent' during a speech in Georgia to mock drug cartels and Democrats
1733,politics,"Jiménez.- En su segundo cierre de campaña de este viernes en el municipio de Jiménez, Juan Carlos Loera, candidato de la Coalición Juntos Haremos Historia en Chihuahua aseguró que ha sido atacado injustamente por el tema del agua, pero gracias a ello se pudo visibilizar el grave problema del agua"
1734,politics,Senate's Capitol commission vote highlights Manchin's filibuster ignorance. The filibuster was never about helping pass good bills — only killing them. Why can't Joe Manchin see this?
1735,politics,Joe Girardi's Bryce Harper injury lie calls for MLB change
1736,politics,The death of independent minded John Warner is a reminder of how much today’s senators have ceded power to party leaders
1737,politics,Biden Banks on $3.6 Trillion Tax Hike on the Rich and Corporations
1738,politics,Who's behind recent rise in US anti-Semitic attacks?
1739,politics,How Mitch McConnell killed the US Capitol attack commission | US Capitol breach
1740,politics,Biden received funds from top Russia lobbyist before Nord Stream 2 giveaway
1741,politics,Biden to Speak at Memorial Service in Delaware Sunday
1742,politics,Oklahoma's lawmakers want to whitewash its history
1743,politics,"Highest debt since WWII, looming fight on taxes: Takeaways from Joe Biden's budget"
1744,politics,"Opinion: After San Jose, the country is again in mourning. It’s time for America to say enough."
1745,politics,The Memo: Marjorie Taylor Greene exposes GOP establishment's lack of power
1746,politics,The Memorjorie Taylor Greene exposes GOP establishment's lack of power
1747,politics,MyPillow CEO Mike Lindell flew Kristi Noem to Republican Governors Association conference on private jet: Politico
1748,politics,Texas Republicans Prepare to Unveil Major Bill of Voting Limits
1749,politics,‘They were just children’: New York Times runs frontpage collage of Gaza’s youngest victims
1750,politics,The GOP push to revisit 2020 has worrisome implications for future elections
1751,politics,DOJ Asks Judge to Clear Lawsuit Against Trump for Violent Clearing of LaFayette Square
1752,politics,AIs from AI Dungeon 2 to sexy to funny and one based wholly on Reddit!
1753,politics,Judge denies request to halt priority status for women and minority restaurant owners seeking aid
1754,politics,"Justice Dept. asks judge to toss lawsuit against Trump, Barr for violent clearing of Lafayette Square???"
1755,politics,Analysis Suggests Setting Aside Bipartisanship Can Help Democrats Win Elections
1756,politics,Trump Wrongly Implies Gas Prices Have Risen Because He’s No Longer President
1757,politics,GOP-Led Legislatures May Pass Voter Suppression Laws With Help of Trump Judges
1758,politics,28% of Republicans Think U.S. So Off Track True Patriots 'May Have to Resort to Violence'
1759,politics,Black Guns Matter founder blasts BLM Incorporated as a 'sham organization'
1760,politics,Ban leads Oklahoma college to cancel class that taught diversity
1761,politics,Undermining of the monetary system
1762,politics,Critical race theory ban leads Oklahoma college to cancel class that taught ‘white privilege’
1763,politics,Bill Maher blasts Democrats' new 'morality' kick: 'We suck the fun out of everything'
1764,politics,The percentage of Americans who say they would never get the COVID vaccine has dropped to a new low of 18%.
1765,politics,Interior designers in chennai
1766,politics,The White House promised a memo on Biden's authority to cancel student debt. Where is it?
1767,politics,"Se pide a los vecinos estar pendientes de las fechas para que participen y saquen los tiliches de sus casas El Gobierno Municipal a través de la Dirección de Servicios Públicos lleva a cabo labores de Destilichadero en distintas zonas de la ciudad, con la intención de eliminar hacinamiento y"
1768,politics,What Ancient Rome Tells Us About Today’s Senate
1769,politics,"A cheater, liar, and a racist."
1770,politics,Tell your Senators to vote no
1771,politics,Threats To Democracy Are Growing Around the World — And The U.S. May Be One Of
1772,politics,Gaetz Says Supporters Should Use the Second Amendment Against Tech Companies
1773,politics,Odisha CM Naveen Patanaik Thanks PM Modi For The Financial Support
1774,politics,Pa. GOP lawmaker Doug Mastriano says he left the Capitol area before the riot. New videos say otherwise.
1775,politics,Georgia high school orders removal of Black Lives Matter display on classroom door
1776,politics,Gonzo Journalism
1777,politics,Donald Trump's Forlorn Scrutiny of 2020 Election Could Lead to GOP Sorrow in 2022
1778,politics,Iowa's only nuclear power plant will be turned into a solar farm - Electrek
1779,politics,Educated voters' leftward shift is surprisingly old and international: A new paper by Thomas Piketty makes the rise of right-wing populism look like a historical inevitability
1780,politics,"State GOP lawmakers try to limit teaching about race, racism"
1781,politics,Arizona Senator Kyrsten Sinema a no show on vote for January 6 Commission
1782,politics,U.S. Senate Republicans block commission into Jan. 6 Capitol attack
1783,politics,Biden administration sides with states in drug import lawsuit
1784,politics,"Senate Republicans block U.S. Capitol riot probe, flaunting loyalty to Trump"
1785,politics,Biden goes viral for 'creepy' moment complimenting young girl during speech: Looks 19 'with her legs crossed'
1786,politics,"US seeks dismissal of cases against Trump for clearing Lafayette Square. Last June, law enforcement removed protesters before the then president walked to a church for a photo op with a Bible"
1787,politics,"GOP blocks Capitol riot probe, displaying loyalty to Trump"
1788,politics,‘You’ve lost your mind’: Paul Gosar mocked for quoting U2 song about MLK to praise slain Capitol rioter
1789,politics,Senate Republicans block creation of bipartisan panel to probe deadly U.S. Capitol riot
1790,politics,"This is your President, well done. You've ruined 🇺🇸"
1791,politics,Arizona Democrat stays mum on why she missed Capitol riot commission vote
1792,politics,"Highest debt since WWII, looming fight on taxes: Takeaways from Joe Biden's budget"
1793,politics,"Tucker's guest comparing Democrats to the Catholic church killing Galileo, strrrrrretch"
1794,politics,Radical Senate Republicans Derail Capitol Insurrection Probe. Just Six GOP Senators Join Democrats Supporting Independent Commission to Investigate Jan. 6 Attack on Congress
1795,politics,"EXCLUSIVE: COVID-19 'has NO credible natural ancestor' and was created by Chinese scientists who then tried to cover their tracks with 'retro-engineering' to make it seem like it naturally arose from bats, explosive new study claims"
1796,politics,Former Palm Beach County GOP leader charged in Capitol riot
1797,politics,"Joe Biden, South Korea’s Moon express willingness to engage North Korea"
1798,politics,Defense for some Capitol rioters: election misinformation
1799,politics,Former 9/11 Commission Head Tom Kean Calls GOP Blocking Jan. 6 Commission 'Sad'
1800,politics,What America thinks; over 50% of Republicans think Antifa/ democrats are to blame for January 6th
1801,politics,Democrats want to allow 60-year-olds into Medicare as part of Biden's infrastructure package
1802,politics,"Someone has to pay for growth. If these bills become law, that’ll be you, not developers | Editorial"
1803,politics,Biden administration backs Alaska oil drilling project approved under Trump
1804,politics,"Bank of America and Chase could restart mortgage foreclosures as early as July, but Wells Fargo is waiting until 2022"
1805,politics,Majority of Republicans blame non-existent ‘left-wing protesters’ for 6 January Capitol attack: poll
1806,politics,Cordray scraps Trump-era policy hindering state investigations of student loan companies
1807,politics,"Deal reached on Texas elections overhaul legislation, lawmakers announce"
1808,politics,Democrats grapple with the enemy within: What to do about the filibuster rule that could kill their agenda
1809,politics,Is Gerrymandering About to Become More Difficult?
1810,politics,Trudeau backs Biden effort to identify origin of COVID-19
1811,politics,"Jewish groups push White House to help counter antisemitism. For Doug Emhoff, it's personal."
1812,politics,Saturday Morning Political Cartoon Thread
1813,politics,Biden Administration affirms controversial Trump decision on Cuba.
1814,politics,Biden goes viral for 'creepy' moment complimenting young girl during speech: Looks 19 'with her legs crossed'
1815,politics,Biden slammed for complimenting little girl's legs and saying she 'looks 19'
1816,politics,"Greene’s Logic: Democrats Are Nazis, So Their Agenda Is Like the Holocaust"
1817,politics,'Creepy' Joe Biden slammed for remarks about 'elementary school-aged' girl
1818,politics,Biden's Creepy Comments towards Girl
1819,politics,Rioters blame their actions on 2020 election misinformation
1820,politics,Democrats grapple with the enemy within: What to do about the filibuster rule that could kill their agenda
1821,politics,Ted Cruz follows suit from red states and introduces a bill to ban the federal government from using vaccine passports
1822,politics,"Biden Budget Shows Focus on Wealth Redistribution, Not Growth"
1823,politics,"Republican Election Chief In Arizona Blasts Madness Of Vote Recount - If it’s so rigged, Stephen Richer jokes, how did he win his post as county recorder as a Republican?"
1824,politics,American Crime Case #12: The 1921 Tulsa Massacre and the Destruction of Black Wall Street
1825,politics,Justice Breyer’s new warning for Democrats couldn’t have come at a worse time | American democracy is in crisis. Breyer thinks now’s the time to scold his fellow liberals.
1826,politics,Biden's budget blowout predicts years of Obama-level tepid growth
1827,politics,"Texas lawmakers pass bill requiring national anthem to be played by pro sports teams | Texas Lt. Gov. Dan Patrick was a staunch advocate for the bill, dubbed the 'Star Spangled Banner Protection Act'"
1828,politics,"American Democracy Isn’t Dead Yet, but It’s Getting There"
1829,politics,More Stimulus = Worse Growth
1830,politics,Rep. Marjorie Taylor Greene broke out a 'really bad Mexican accent' during a speech in Georgia to mock drug cartels and Democrats
1831,politics,‘I Could Make Up a Fake Arrest and Put You in Jail’: Police Chief Agrees to Plead Guilty to Threatening an Arrest Over Negative Facebook Post
1832,politics,Republicans could easily win fair-and-square. They're choosing Trump instead.
1833,politics,"Andrew Yang, Political Kardashian"
1834,politics,"Marjorie Taylor Greene challenger ""kicked out"" of ""America First"" rally in Georgia"
1835,politics,10 Cops Got Qualified Immunity After Holding a Shackled Man Facedown Until He Died
1836,politics,Biden Administration Defends Huge Alaska Oil Drilling Project
1837,politics,How Mitch McConnell killed the US Capitol attack commission
1838,politics,Biden’s Fossil Fuel Moves Clash With Pledges on Climate Change
1839,politics,Sen. Kyrsten Sinema misses Jan. 6 commission vote amid GOP filibuster
1840,politics,Schumer Says Vote on For the People Act Coming Next Month
1841,politics,Lebanon becomes first Ohio city to ban abortions
1842,politics,It’s time to end the filibuster. Let’s send Manchin a message.
1843,politics,Rioters blame their actions on 2020 election misinformation
