,subreddit,title
0,politics,"Secret Service Spending $34,000 on Fancy Porta Potties in Bedminster This Summer"
1,politics,"MAGNO MALTA CONVIDA NISE YAMAGUCHI QUE RELATA HORROR NA CPI:""FIQUEI ESPE..."
2,politics,"Melanie Stansbury, a Democrat, Wins House Race in New Mexico | Ms. Stansbury, a state lawmaker, prevailed in a special election to fill the seat vacated by Interior Secretary Deb Haaland. She beat Mark Moores, a Republican, in a race centered on issues of crime."
3,politics,Gov. Greg Abbott orders Texas child-care regulators to yank licenses of facilities housing immigrant kids
4,politics,woah
5,politics,"Sen. Kyrsten Sinema says she missed Jan. 6 commission procedural vote for ""family matter"""
6,politics,"Sen. Mark Kelly touts infrastructure work, says it's 'critical' to investigate origins of Jan. 6 Capitol riot"
7,politics,1000 Civil Disobedience Arrests Expected if Minnesota Gov. Walz Doesn't Stop Line 3 Tar Sands Pipeline
8,politics,"‘SpongeBob’ and ‘Transformers’ Cost U.S. Taxpayers $4 Billion, Study Says | A new report details ViacomCBS’s use of a labyrinthine tax shelter to sell rights to its shows and films overseas."
9,politics,Biden decries 'horrific' Tulsa massacre in emotional speech
10,politics,RNC vows to advise candidates against future presidential debates unless commission makes significant changes
11,politics,NAACP president: Biden’s racial wealth gap plan falls short unless it addresses student debt crisis
12,politics,Daniel Ellsberg Explains Why Now Was the Right Time to Release Top-Secret File on Nuclear Weapons | The document about a 1958 crisis shows officials eagerly making the case for atomic warfare against China.
13,politics,Mississippi overturns the people’s majority vote on a technicality
14,politics,"Tulsa Race Massacre: How 'Watchmen,' 'Lovecraft Country' Raised Public Awareness for the Tragedy"
15,politics,Libtards are morans and their to stupid to except facts that dont sapport there narative cause they dont no anything u should of lisened in school and u would'nt be so dum your ruining are country
16,politics,Florida governor bans transgender women and girls from school sports
17,politics,House Democrats seek ways to investigate January 6 after Senate Republicans block commission
18,politics,"Fox News Poll: Half of voters support the border wall, matching record"
19,politics,GOP lawmakers hit Biden on lumber prices
20,politics,"Cuomo probes move toward critical points with his tenure, legacy at stake"
21,politics,Christian Billionaires Are Funding a Push to Kill the Equality Act
22,politics,Discussion Thread: NM-01 Special Congressional Election Results
23,politics,Interior Department Suspends Oil and Gas Leases in Arctic National Wildlife Refuge - Agency to Review Underlying Analysis of Oil and Gas Leases on the Coastal Plain
24,politics,"Louie Gohmert Says He Isn’t a QAnon Supporter, Just a Moron"
25,politics,Upcoming Trump rallies will help Democrats remind voters why they didn't re-elect him
26,politics,National Enquirer Publisher Fined Over Payment for Trump Story
27,politics,"National Enquirer Parent, Ex-CEO Fined for Breaking Election Law in 2016 Campaign"
28,politics,N.Y. gov candidate Andrew Giuliani refuses to wear mask indoors while campaigning despite being unvaccinated
29,politics,Kamala Harris Lets the World Know She Is Not Responsible for Managing the Border Crisis No Matter What Joe Biden Says.
30,politics,Pelosi floats Democrat-led investigation of Jan. 6 as commission alternative
31,politics,Trump's Telling People He Will Be ‘Reinstated’ as President by August: Report
32,politics,Vladimir Putin to press Joe Biden on Capitol rioters' rights
33,politics,Lt. Gov. Fetterman defies law to mark start of Pride Month
34,politics,Workers begin removing Forrest remains from Tennessee park
35,politics,r/politics is complete trash and soy milk tastes disgusting.
36,politics,Biden: Young Black Entrepreneurs 'Don't Have Lawyers or Accountants'
37,politics,Tucker: Stupid people took control of our country
38,politics,The Southwest Is America’s New Factory Hub. ‘Cranes Everywhere.’
39,politics,James From the 1ternet is asking us the big political question: But Without The Police Who Would Commit All These Crimes?
40,politics,Can Biden close the racial wealth gap?
41,politics,Biden administration officially ends Trump's 'remain in Mexico' asylum policy
42,politics,ABC legal analyst: 'All signs point to a likely indictment' in Trump case
43,politics,Amazon backs federal bill to legalize marijuana and adjusts drug testing policy for some workers
44,politics,Dan Abrams tells TheView “all signs point to a likely indictment” in Trump investigation.
45,politics,Biden calls out 2 Democratic lawmakers for blocking agenda
46,politics,"Organized Retail Theft On The Rise; Cops Blame Prop 47, Safe Neighborhoods Law"
47,politics,"Biden calls out Sinema, Manchin for voting 'more with Republicans'"
48,politics,Tulsa race massacre survivors testify before congressional subcommittee
49,politics,Biden Takes Rare Swipe At Manchin And Sinema As Senate Nears Filibuster Fight
50,politics,ABC’s Dan Abrams: ‘All Signs Point To A Likely’ Trump Indictment
51,politics,"If the development of science happens to be blocked, what a politician should vote for?"
52,politics,Christian Billionaires Are Funding a Push to Kill the Equality Act
53,politics,QAnon Conference Organizer Won’t Answer Questions About Whether Michael Flynn Was Paid | The retired lieutenant general endorsed a coup at a right-wing confab in Dallas.
54,politics,"Biden appears to criticize Democrats Joe Manchin and Krysten Sinema, saying some members of his party 'vote more with my Republican friends'"
55,politics,U.S. formally ends Trump’s 'remain in Mexico' asylum policy
56,politics,Statement of Concern The Threats to American Democracy and the Need for National Voting and Election Administration Standards
57,politics,Texas Just Provided a Sneak Peek of America’s Next Right-Wing Nightmares
58,politics,Florida celebrates first day of Pride Month with law attacking trans kids’ rights. Gov. Ron DeSantis held a ceremony at a Christian school to sign a bill banning transgender girls from participating in school sports. Happy Pride Month!
59,politics,Joe Biden touching girls inappropriately compilation
60,politics,Texas officials speak at Qanon-affiliated event where Trump adviser Michael Flynn encouraged military coup on U.S. government
61,politics,"Fact check: No, Trump can't 'simply be reinstated' as president"
62,politics,The Best Political Commentary Blogs and Newsletters of 2021
63,politics,Economist surprised Trump-era tax break survived Biden budget plan
64,politics,Economist surprised Trump-era tax break survived Biden budget plan
65,politics,Bannon has his MAGA megaphone back. GOP candidates know it.
66,politics,West Virginia To Give Away Guns As Covid-19 Vaccine Incentive
67,politics,Flynn’s Coup Talk Is a Warning About the MAGA Violence Ahead
68,politics,Florida threatens to slap cruise lines with tens of thousands of dollars in fines | Daily Mail Online
69,politics,‘Pharma Bro’ Martin Shkreli Gets a Slap on the Wrist for Using Contraband Phone to Discuss Pharma Business Behind Bars
70,politics,‘A slap in the face’: Unemployed San Antonians weigh in after Gov. Abbott opts out of extra $300 per week
71,politics,Amazon Backs Federal Bill to Legalize Marijuana and Adjusts Its Drug Testing Policy for Some Workers
72,politics,(VIDEO) Joe Biden Says Black Entrepreneurs Don't Succeed Like Whites Because They Don't Know How to Find Lawyers or Accountants
73,politics,U.S. senator expects U.S. to send more funds for Israel's 'Iron Dome'
74,politics,"Menendez mischief, aided by Booker, gets slap-down at White House | Moran - nj.com"
75,politics,"Joe Biden blames trouble passing voting rights on 2 Dems ""who vote more"" with GOP"
76,politics,Public option likely all but a done deal after Assembly approves bill on party lines
77,politics,"Despite his predictions, Trump won't simply be reinstated as president"
78,politics,Anti-vax evangelical pastor Rick Wiles hospitalized with COVID-19 - New York Daily News
79,politics,NAACP's Hazel Dukes joins parole reform push for New York - New York Daily News
80,politics,Immigration: Biden formally ends 'remain in Mexico' policy after suspending it earlier this year - CNNPolitics
81,politics,Donald Trump gets a highway named after him in Oklahoma thanks to Republicans | The Independent
82,politics,Republicans aren’t ‘looking forward.’ They’re stepping into a Jim Crow past.
83,politics,Biden suspends oil-drilling leases in Alaska's Arctic refuge
84,politics,NAACP prez slams Biden for no student loan cancelation plan
85,politics,Texas State Rep.'s message to Sen. Manchin on filibuster: 'Please cowboy up'
86,politics,Republicans More Hesitant of Getting the COVID-19 Vaccine: UC San Diego Study
87,politics,Nevada throws down the 2024 gauntlet
88,politics,China State Media Says Country Must Prepare for Nuclear War After Biden Agrees to Watered-Down Covid Probe
89,politics,Poll: 44% of Republicans think Bill Gates to use COVID-19 vaccine to implant tracking chip
90,politics,DeSantis Kicks Off Pride Month by Signing 'Appalling' and 'Shameful' Attack on Trans Student Athletes
91,politics,Gen. McCaffrey: Flynn's talk about a coup is very dangerous
92,politics,Arizona prepares to use Auschwitz gas Zyklon B on death row inmates
93,politics,California Convenes Reparations Task Force for First Time as Gavin Newsom Touts 'More Equitable' Future
94,politics,"Biden, marking race massacre in Tulsa 100 years ago, denounces ’ ‘un-American’ GOP bills to hamper Black voters in Texas and elsewhere"
95,politics,Biden takes shot at Democrats Manchin and Sinema for voting 'more with my Republican friends'
96,politics,"'Hell was unleashed': Biden urges reckoning on race at Tulsa massacre anniversary, taps Harris to lead on voting rights"
97,politics,"Faith in numbers: Fox News is must-watch for white evangelicals, a turnoff for atheists"
98,politics,Free Guns Are Now a COVID-Vaccine Incentive in the US - Some lucky vaxxed people in this state will win one of 10 custom-made rifles and shotguns in a Father’s Day drawing.
99,politics,Brian Sicknick's partner: GOP senators 'spit in the face' of late Capitol Police officer
100,politics,"Cuomo to Host $10,000-a-Ticket Campaign Fundraiser in NYC"
101,politics,ABC legal analyst: 'All signs point to a likely indictment' in Trump case
102,politics,Please tell us why you threw Capitol police under the bus | Sam Venable
103,politics,"Gig workers to lose all unemployment benefits in 20 GOP states: ""You can't prepare for it"""
104,politics,Pro-Trump Crackpots’ Talk Gets More Dangerous. Should We Worry?
105,politics,US lawmakers want Ma’Khia Bryant foster care journey probed | The Seattle Times
106,politics,Pelosi rules out having Biden create Jan. 6 commission
107,politics,Pelosi rules out having Biden create Jan. 6 commission
108,politics,Biden taps Harris to tackle voting rights legislation
109,politics,Biden Administration Suspends Arctic National Wildlife Refuge Drilling
110,politics,"Founder of Black Lives Matter chapter quits, says BLM doesn’t actually care about black people"
111,politics,Trump’s Republicans Want a Coup | Michael Flynn’s embrace of a Myanmar-style military overthrow is chilling. It’s also a growing position within the GOP.
112,politics,"Rashad Turner, ex-BLM leader, calls out group, says it doesn't care about Black families"
113,politics,Who pays for cobra coverage under the American Rescue Plan?
114,politics,Biden Appears to Swipe at Manchin and Sinema During Tulsa Speech: ‘Two Members of the Senate Who Vote More with My Republican Friends’
115,politics,Donald Trump endorses Gov. Greg Abbott for reelection
116,politics,Donald Trump endorses Texas Gov. Greg Abbott for reelection
117,politics,"Joe Biden asks congress $453,8 million for Colombia"
118,politics,Tulsa massacre: Biden urges Americans to reflect on ‘deep roots of racial terror’
119,politics,Creepy Joe Biden Beelines to Young Girls in Crowd Before Speech on Tulsa Race Massacre to 'Make Sure They Get Ice Cream' (VIDEO)
120,politics,White biker gang mobs young black girls lemonade stand
121,politics,Trump expects to be ‘reinstated’ by August amid coup suggestions from supporters
122,politics,Trump has reportedly been telling people he'll be 'reinstated' by August
123,politics,FEC Fines National Enquirer Publisher For Role In 2016 Trump Hush Money Scheme
124,politics,Terrance Williams and his daughter.
125,politics,Alaska: Biden to suspend Trump Arctic drilling leases
126,politics,İstenmeyen Tüylere Son
127,politics,Republicans say they'll tweak part of Texas elections bill criticized for impact on Black churchgoers
128,politics,"Biden says he has ""two members of the Senate that vote more with my Republican friends""."
129,politics,Arizona audit: Pennsylvania senator who bused protesters to US Capitol insurrection will receive tour of controversial GOP-led ballot-counting operation
130,politics,Biden puts Harris in charge of efforts to protect voting rights
131,politics,"Gold&amp;Black Liberty Discord - a place for peaceful, democratic discussion with libertarians"
132,politics,"CBSE, ISC 12th Exam Cancelled; PM says ,”Health and safety of our students is of utmost importance”"
133,politics,"In Exclusive Jailhouse Letter, Capitol Riot Defendant Explains Motives, Remains Boastful — ProPublica"
134,politics,Ben Carson Criticizes Biden’s Budget Despite HUD $31K Dining Set Fiasco | NewsOne
135,politics,White House Says Russian Criminals Likely Behind JBS Cyberattack
136,politics,Tony Perkins Admits That Lawmakers Overestimate the Influence of Pastors
137,politics,Biden memorializes Tulsa victims on 100th anniversary: 'This was not a riot. This was a massacre'
138,politics,Former WH ethics lawyer: Flynn should be court-martialed
139,politics,Why Senate Republicans are just fine with Joe Manchin calling them every name in the book - CNNPolitics
140,politics,"Kushner Companies Violated Multiple Laws in Massive Tenant Dispute, Judge Rules — ProPublica"
141,politics,Trump Spawned a New Group of Mega-Donors Who Now Hold Sway Over the GOP’s Future — ProPublica
142,politics,The U.S. Owes Hawaiians Millions of Dollars Worth of Land. Congress Helped Make Sure the Debt Wasn’t Paid. — ProPublica
143,politics,"He Bought Health Insurance for Emergencies. Then He Fell Into a $33,601 Trap. — ProPublica"
144,politics,Documents Show Trump Officials Used Secret Terrorism Unit to Question Lawyers at the Border — ProPublica
145,politics,"Dubious Arrests, Death Threats and Confederate Loyalists: Welcome to Graham, S.C. — ProPublica"
146,politics,Marjorie Taylor Greene Appeared in a Super PAC Ad Asking for Money. That Might Break the Rules. — ProPublica
147,politics,“Shadow Wins”: How ICE Avoids Judicial Accountability by Quietly Releasing Immigrants Who Challenge Being Detained — ProPublica
148,politics,Donald Trump Built a National Debt So Big (Even Before the Pandemic) That It’ll Weigh Down the Economy for Years — ProPublica
149,politics,"Disputing Racism’s Reach, Republicans Rattle American Schools"
150,politics,Flynn’s Coup Talk Is a Warning About the MAGA Violence Ahead
151,politics,Michael Flynn denies calling for a coup (despite video of him doing it)
152,politics,"Biden says little girl ""looks 19"" when her legs were crossed."
153,politics,"Biden says he has “two members of the Senate who vote more with my Republican friends""."
154,politics,Biden reportedly freezes Alaska oil drilling leases that were among Trump’s parting moves
155,politics,"The Secret Service is reportedly spending nearly $35,000 to rent portable toilets near Trump's Bedminster golf club"
156,politics,Florida Program to Aid Brain-Damaged Infants Publicly Embraces Reforms It Once Fought — ProPublica
157,politics,Clean-Energy Loans Trapped Black Homeowners in Debt. The Legislature Just Started Trying to Fix the Problem. — ProPublica
158,politics,How the Deals Approved by Congress Bypassed Thousands of Hawaiians Waiting for Homes — ProPublica
159,politics,A Nonprofit Promised to Preserve Wildlife. Then It Made Millions Claiming It Could Cut Down Trees. — ProPublica
160,politics,Missouri Lawmakers Approve Reforms to Controversial Clean-Energy Loan Program — ProPublica
161,politics,Hundreds of PPP Loans Went to Fake Farms in Absurd Places — ProPublica
162,politics,"In a Small Town, a Battle for Racial Justice Confronts a Bloody Past and an Uncertain Future — ProPublica"
163,politics,The Colonial Pipeline Ransomware Hackers Had a Secret Weapon: Self-Promoting Cybersecurity Firms — ProPublica
164,politics,“This Is How You Get Your Power Back” — ProPublica
165,politics,"In the Fight to Save American Democracy, Joe Manchin Is Neville Chamberlain"
166,politics,The U.S. Broke Its Promise to Return Land to Hawaiians. My Family Knows Something About Land Loss. — ProPublica
167,politics,An Online Lender Gave Hundreds of PPP Loans to Fake Farms. Now Congress Is Investigating. — ProPublica
168,politics,"America’s Richest School Serves Low-Income Kids. But Much of Its Hershey-Funded Fortune Isn’t Being Spent on the children, it is being spent on executive bonuses. — ProPublica"
169,politics,Eugene Clemons May Be Ineligible for the Death Penalty. A Rigid Clinton-Era Law Could Force Him to Be Executed Anyway. — ProPublica
170,politics,"Secret Service Spending $34,000 on Fancy Porta Potties in Bedminster This Summer"
171,politics,"DeSantis signs Trans girl sports ban on first day of LGBTQ Pride Month, protests and legal challenges swiftly follow"
172,politics,"Biden administration to suspend oil and gas drilling leases in Arctic refuge, undoing a Trump-era decision - CNNPolitics"
173,politics,Unvaccinated and nonplussed: Andrew Giuliani refuses to wear mask indoors while campaigning despite vaccine status
174,politics,DeSantis signs controversial bill banning transgender women and girls from sports
175,politics,Democrat Nikki Fried announces run for Florida governor
176,politics,Black CNN security guard sues over arrest during George Floyd protest in Minneapolis
177,politics,"Opinion | Democrat or Republican, You Probably Love the Post Office - The New York Times"
178,politics,"Sorry Senator Schatz, You Should Pay for Infrastructure"
179,politics,"'This was not a riot, this was a massacre': Biden commemorates 100th anniversary of the racist Tulsa attack that killed hundreds of Black people"
180,politics,Trump has reportedly been telling people he'll be 'reinstated' by August
181,politics,"'This was not a riot, this was a massacre': Biden calls on US to reckon with history of racist violence in Tulsa speech"
182,politics,Anti-vaxxers are claiming centuries of Jewish suffering to look like martyrs | Yellow badges were used for discrimination long before the Holocaust
183,politics,Michael Flynn denies calling for a coup (despite video of him doing it)
184,politics,House Speaker Dade Phelan says Gov. Greg Abbott could hurt staffers and legislative agencies if he tries to block lawmaker salaries
185,politics,Biden administration suspends oil and gas leases in Arctic National Wildlife Refuge
186,politics,Biden suspends oil leases in Alaska’s Arctic refuge
187,politics,Her great-grandmother survived the Tulsa Race Massacre. She wants Biden to embrace reparations.
188,politics,Florida joins U.S. states banning transgender girls from female sports
189,politics,Opinion | The Radical Modesty of Biden’s Budget
190,politics,Her great-grandmother survived the Tulsa Race Massacre. She wants Biden to embrace reparations.
191,politics,Biden urges US to reckon with history of racist violence in passionate Tulsa speech
192,politics,Lauren Boebert is known for her far-right Republican views. But Republicans alone didn’t send her to Congress.
193,politics,Michael Flynn should be sitting in prison awaiting trial for sedition: former White House attorney
194,politics,"A Prosecutor Sexually Harassed Women Across The Federal Government, A Watchdog Agency Found"
195,politics,A intersting video
196,politics,Supreme Court Endorses Sovereignty of Indian Tribes to Detain Non-Indian Drivers Who Threaten the 'Health or Welfare of the Tribe'
197,politics,The Justice Department Is Dropping A Capitol Riot Prosecution For The First Time
198,politics,Let’s Cut Our Ridiculous Defense Budget
199,politics,Israel to ask U.S. for $1 billion in emergency military aid
200,politics,Biden freezes oil leases in Alaska refuge pending new environmental review
201,politics,Why Student-Loan Forgiveness Wasn’t in Biden’s Budget
202,politics,There’s a ticking climate time bomb in West Texas: Biden faces a critical decision about the Permian Basin and its methane emissions from oil and gas.
203,politics,"Biden administration to suspend oil and gas drilling leases in Arctic refuge, undoing a Trump-era decision"
204,politics,Supreme Court Endorses Sovereignty of Indian Tribes to Detain Non-Indian Drivers Who Threaten the ‘Health or Welfare of the Tribe’
205,politics,LIVE UPDATES: President Biden delivers remarks to commemorate 100 years since Tulsa Race Massacre
206,politics,"نتنياهو يتعهد ""بعدم السماح بإيران نووية"" حتى على حساب ""خلاف إسرائيل مع الولايات المتحدة"""
207,politics,"""LeBron James Is a Piece of Crap, a Piece of Garbage"" - MMA Champion Colby Covington UNLOADS on NBA Star and China Apologist LeBron (VIDEO) - The Washington County Auditor"
208,politics,How the Military Should Deal With Its Michael Flynn Problem
209,politics,Biden formally ends Trump-era 'Remain in Mexico' immigration program
210,politics,Analysis: Why Senate Republicans are just fine with Joe Manchin calling them every name in the book
211,politics,Republican Voter Suppression Is Canceling Marijuana Legalization
212,politics,The Biden administration plans to suspend Arctic drilling leases issued during the last days of Trump’s term.
213,politics,Massachusetts court rules text messages can be used against their senders
214,politics,More Than A Dozen States Are Trying To Nullify Federal Gun Control
215,politics,Texas Republicans Want to Make Trump’s Coup Nice and Legal | Michael Flynn said a coup “should happen”; Republicans prefer to use the legislature.
216,politics,Texas Republicans Want to Make Trump’s Coup Nice and Legal Michael Flynn said a coup “should happen”; Republicans prefer to use the legislature.
217,politics,Biden hits back at states targeting trans youth in Pride Month proclamation
218,politics,West Virginia To Give Away Guns As Covid-19 Vaccine Incentive
219,politics,"With anti-election crusade, Trump reportedly has an endgame in mind"
220,politics,100 Democracy Experts Issue Dire Warning About The American Experiment
221,politics,The Republican Party Is an Existential Threat to American Democracy
222,politics,Trump is Reportedly Telling People He Will Be Reinstated as President By August
223,politics,California moves forward with reparations effort to create 'more equitable' future
224,politics,Pennsylvania's Fetterman says Republicans removed Pride flags from his office again
225,politics,Federal Agency: Businesses Can Make Employees Get COVID-19 Vaccine
226,politics,Democrats grapple with the enemy within: What to do about the filibuster rule that could kill their agenda
227,politics,"Founder of Black Lives Matter Chapter Quits, Says BLM Doesn’t Actually Care About Black People"
228,politics,China Works to Secure Maritime Access to Middle Eastern and African Oil
229,politics,Biden Budget Includes Plan to Help Poor Buy Flood Insurance
230,politics,Senator Maggie Hassan is rooting out corruption in both parties and standing up to special interest money with the For the People Act. Thank her for working for us.
231,politics,Karine Jean-Pierre Is The 1st Black Woman In Decades To Brief White House Press
232,politics,McConnell signals concern over changes to qualified immunity in police reform
233,politics,McConnell signals concern over changes to qualified immunity in police reform
234,politics,"U.S. Embassy To The Vatican Flies Pride Flag, Prompts Backlash"
235,politics,"‘Not a good look’: US Embassy in Vatican flies LGBT pride flag, offending Catholics"
236,politics,US Embassy to Vatican flies LGBT ‘Pride’ flag
237,politics,What?
238,politics,"Who Is Karine Jean-Pierre, 1st Black Woman In White House Briefing In Decades? : NPR"
239,politics,Supreme Court: Tribal police may detain non-Native Americans on reservation highways
240,politics,The Justice Department Is Dropping A Capitol Riot Prosecution For The First Time
241,politics,DeSantis signs bill banning trans girls from women's sports
242,politics,First Biden Budget Retains Trump-Era Business Tax Break
243,politics,BLM Founder Steps Down?!
244,politics,"Omar reintroduces bill to repeal law used to justify Trump's Muslim ban, Japanese-Americans' internment"
245,politics,Texas Gov. Abbott says he’ll target legislators' pay after Democrats block restrictive voting bill
246,politics,"White House says Russian criminals are likely behind the cyberattack on the world's largest meat supplier, JBS USA"
247,politics,Biden to announce new steps to close racial wealth gap while marking 100th anniversary of Tulsa Race Massacre
248,politics,"Hyperinflation Is Coming, And You Have A Very Limited Amount Of Time To Prepare"
249,politics,Obama says GOP backlash to first Black president reflects 'the history of America'
250,politics,Lightfoot sued for limiting interviews to reporters of color
251,politics,"The Perils of an “America First” Climate Policy | To meet his climate promises, Biden will have to abandon the U.S. tradition of hawkish nationalism in favor of global cooperation."
