,subreddit,title
2106,politics,Schumer and Collins appear to have heated exchange before Jan. 6 vote
2107,politics,Senate confirms geneticist Lander as Biden science adviser
2108,politics,Ted Lieu comes after Matt Gaetz following rally remarks about Silicon Valley
2109,politics,"Greene, Under Fire, Fires Back - Atlanta Jewish Times"
2110,politics,Matt Gaetz Tells Fans to Carry Out ‘Armed Rebellion’ Against Government if Neccessary
2111,politics,"Employers Can Require Covid-19 Vaccine Under Federal Law, New Guidance States"
2112,politics,$11 Billion New York-New Jersey Rail Tunnel Gets Key Federal Approval | The tunnel is part of the broader Gateway project to expand rail capacity in the New York region
2113,politics,US seeks freedom for 2 American journalists in Myanmar
2114,politics,‘2 If By Sea’: Oath Keepers Messages Shed New Light on Alleged Plot to Storm D.C. With Guns by Way of Potomac
2115,politics,Facebook Whistleblower Leaks ‘Vaccine Hesitancy’ Censorship Documents
2116,politics,"Pentagon seeks $715 billion in future-focused budget that scraps OCO, boosts climate-change funding and increases pay for troops by 2.7%"
2117,politics,Bernie Sanders slams Republicans who blocked Jan. 6 commission as 'too intimidated by Trump to do the right thing'
2118,politics,"American Democracy Isn’t Dead Yet, but It’s Getting There"
2119,politics,"'It's the Filibuster or Democracy,' Say Progressives After GOP Tanks January 6 Commission"
2120,politics,Business owners can get 6 months in jail if they don’t post sign warning about transgender shoppers
2121,politics,The Filibuster Discourages Bipartisanship. The GOP Filibuster Of A Jan. 6 Commission Just Proved it.
2122,politics,Biden Is Planning To Make Big Changes To How The US Handles Asylum-Seekers At The Border
2123,politics,"QAnon may be a cult, but it's as big as Methodist, Presbyterian, and Lutheran churches combined"
2124,politics,"Senate GOP blocks Jan. 6 commission, likely dooming independent investigation"
2125,politics,Trump fires back at Paul Ryan: 'Curse to the Republican Party'
2126,politics,San Jose mass shooting: VTA killer evaded California’s tough gun laws
2127,politics,Sen. Murkowski: McConnell is putting politics above Jan. 6 commission
2128,politics,(VIDEO) Another Massive Brawl Breaks Out at Miami International Airport!
2129,politics,Trump Announces He Got $1.2 Billion Loan. From who? The Rothschild's?
2130,politics,"California drought enters dangerous territory. What’s ahead for fish, farms and cities"
2131,politics,California woman accused in flight attendant attack banned for life by Southwest
2132,politics,Manchin's political worldview was put to the test (and it lost)
2133,politics,"Tamaulipas.- El presidente nacional de Morena, Mario Delgado, denunció que hombres armados lo encañonaron en una carretera de Tamaulipas. “Nos acaban de detener, apuntándonos con armas largas en la carretera en Tamaulipas, entre Matamoros y Reynosa”, denunció el dirigente partidista."
2134,politics,The GOP Can’t Be Saved—And Neither Can Paul Ryan
2135,politics,Sen. Kyrsten Sinema skips Jan. 6 US Capitol riot commission vote
2136,politics,Here we go again with the ‘I created more jobs’ thing
2137,politics,'Some people have no shame': Biden calls out GOP lawmakers with list
2138,politics,Biden calls out Republicans who have taken credit for rescue plan but voted against it
2139,politics,California drought enters dangerous territory.
2140,politics,"Postal Employee Admits Dumping Mail, Including Election Ballots Sent to West Orange Residents"
2141,politics,Senate Republicans block bill to create commission to probe pro-Trump Capitol insurrection
2142,politics,Republicans block independent commission to investigate attack on U.S. Capitol
2143,politics,Biden Is Planning To Make Big Changes To How The US Handles Asylum-Seekers At The Border
2144,politics,Biden has released his $6 trillion budget. Here's what's in it. — CNN Politics
2145,politics,"Nate Silvester, fired TikTok cop, says he is ""latest target of cancel culture"""
2146,politics,"In victory for Trump, Republicans block probe of U.S. Capitol riot"
2147,politics,GOP senators block bill to create Capitol riot commission
2148,politics,Trump Wanted Meatpacking Plants To Run Faster. Biden Is Slowing Them Down.
2149,politics,"54-35, Senate Republicans block effort to open debate on bill to create an outside commission to probe Jan. 6 attack."
2150,politics,"Senate To Vote On Election Reform Next Month, Setting Up Another Filibuster Fight"
2151,politics,‘Tyranny’: Idaho Gov. Brad Little repeals McGeachin’s ban on mask mandates
2152,politics,"John McAfee faces dying in prison for the same thing Elon Musk does on Twitter, says his wife"
2153,politics,"Among national flood of anti-trans bills, Nevada lawmakers pass LGBTQ+ affirming legislation"
2154,politics,Biden tells troops they are 'the backbone' of America
2155,politics,Trump and Giuliani ask judge to drop Capitol riot conspiracy case
2156,politics,Matt Gaetz tells supporters to use ‘2nd Amendment’ against Big Tech: report
2157,politics,"Manchin: Republican filibuster of Jan. 6 commission ""unconscionable"""
2158,politics,"The GOP Can’t Be Saved—And Neither Can Paul Ryan | Ryan has become the latest Republican to urge his party to relinquish Trumpism and return to its principled past. The problem is, that past doesn’t exist."
2159,politics,I need your help! Sign the Petition
2160,politics,"New Records Include Private Executives’ Emails with Hahn, Kushner"
2161,politics,"Following Forum, Al Sharpton Says His Mayoral Endorsement Will Come In June"
2162,politics,"Good grief, it's now raining election audits in Arizona"
2163,politics,Gun Church That Worships With AR-15s Bought a 40-Acre Compound in Texas for Its ‘Patriots’
2164,politics,CDC relaxes COVID-19 guidelines for summer camps
2165,politics,Russia Appears to Carry Out Hack Through System Used by U.S. Aid Agency
2166,politics,White House: Biden 'remains committed' to Jan. 6 probe
2167,politics,"How the Drug War Destroyed Over $11 Trillion in Wealth, in Addition to Costing Us $5.3 Trillion - Bengal Capital"
2168,politics,Flying over Memorial Day? Expect long lines at airports
2169,politics,"Matt Gaetz threatens to run for president in 2024 — but only if Trump doesn't: Embattled congressman trolls foes, delights fans with promise to ""whoop Joe Biden"" if Trump backs out of '24 race"
2170,politics,Senate GOP blocks Jan. 6 commission
2171,politics,Republicans’ blocking of the Capitol commission shows how deep the rot is
2172,politics,Biden has released his $6 trillion budget. Here's what's in it.
2173,politics,"Chief tries to uncover fraud and embezzlement, fired."
2174,politics,Why Do People Believe in Conspiracy Theories?
2175,politics,Whistleblower Reveals Elon Musk’s Future plans for the coming years
2176,politics,Democrats say David Chipman’s the perfect candidate to run the agency conservatives hate: ATF
2177,politics,Michigan ambulance providers sounding the alarm on lack of funding
2178,politics,Police Chief Fired
2179,politics,"With Idaho governor out of state, lieutenant governor bans mask mandates"
2180,politics,"PM Modi conducts aerial survey to assess impact of Yaas; announces financial relief for cyclone-hit Jharkhand, Odisha, WB"
2181,politics,Senate GOP blocks legislation on Jan. 6 commission
2182,politics,U.S. Is Said to Have Unexamined Intel to Pore Over on Virus's Origin
2183,politics,A 'summit of democracy' is a great opportunity
2184,politics,Senate Republicans Block Jan. 6 Riot Commission
2185,politics,"Senate Republicans Block Jan. 6 Riot Commission. And now, the republicans have guaranteed another insurrection. And another."
2186,politics,"Tulsa Race Massacre events could be targeted by white supremacist groups, Department of Homeland Security warns"
2187,politics,Republicans block the creation of an independent inquiry into the Jan. 6 riot.
2188,politics,Harris cites challenges of 'fragile' world in Navy speech
2189,politics,House Republicans demand congressional probe into COVID-19 origin
2190,politics,"Waning concerns about pandemic may mean less demand for early voting, Virginia officials say"
2191,politics,"Now that GOP has killed 1/6 commission, Democrats must play hardball"
2192,politics,Mark Carney ably rebuffs a rabid ferret
2193,politics,Biden releases $6T budget that foresees decade of trillion-dollar deficits
2194,politics,What’s Happening In Arizona Is Not Really An Audit Or A Recount. It’s A Partisan Inquisition.
2195,politics,Most Americans oppose unrestricted aid to Israel: Poll
2196,politics,"Sen. Murkowski delivers pointed criticism of fellow Republicans, including McConnell, who oppose Jan. 6 commission"
2197,politics,Judge orders special master to review Rudy Giuliani's electronic devices
2198,politics,"Lakeland, FL’s Scott Franklin among freshman Congress members with most missed votes, he says numbers mislead"
2199,politics,Marjorie Taylor Greene attempts Mexican accent during speech about cartels
2200,politics,"GAO Report on Sailor Fatigue, Crewing Shortfalls"
2201,politics,"Biden budget includes his big-ticket spending plans, would boost health, education funding"
2202,politics,"A $6 trillion budget lays out Biden's vision, but Republicans unlikely to be swayed"
2203,politics,"Senate GOP blocks Jan. 6 commission, likely dooming independent investigation"
2204,politics,WHO says Covid origin investigation is being ‘poisoned by politics’
2205,politics,"Biden's $6 trillion budget proposals calls for surge in domestic spending, higher taxes"
2206,politics,Polls find most Republicans say 2020 election was stolen and roughly one-quarter embrace QAnon conspiracies
2207,politics,'Cowardice': John King hits senators who left town ahead of vote
2208,politics,Biden's $6 trillion budget dropped key campaign promises on student debt cancellation and healthcare reform
2209,politics,Politics funding the dismantling of inequality and discrimination.
2210,politics,Mamata Banerjee Urges PM Modi For Special Economic Package
2211,politics,Republican Sen. Tommy Tuberville says he'd 'rather be fishing or golfing' before voting against the Capitol riot commission
2212,politics,Schumer to force vote on sweeping election overhaul next month
2213,politics,"Biden criticizes Trump for not doing anything on infrastructure They think they’re going to win,” Biden said of China. “But I got news for them. They will not win this race.”"
2214,politics,I don’t think Brian Williams likes Ted Cruz very much.
2215,politics,Senate Dems reject ban on certain types of human-animal hybrid experiments
2216,politics,Democrats are falling for Republicans' fake negotiations again
2217,politics,"Chihuahua.- Un oso fue visto en el patio de un domicilio en el seccional de El Charco, buscaba alimento en los tambos de basura. El presidente seccional de El Charco, Carlos Ramos, dio a conocer en su cuenta de Facebook que el oso ya fue reportado con la Profepa para la protección del animal."
2218,politics,"Israeli troops kill Palestinian during West Bank clash, Palestinians say"
2219,politics,Texans petition governor to reinstate COVID unemployment after $300 payments end
2220,politics,Texans Petition Governor to Reinstate COVID Unemployment After $300 Payments End
2221,politics,Matt Gaetz Encourages Supporters to Shoot Silicon Valley Execs Over Alleged Suppression of Conservative Voices
2222,politics,Texas Governor Defends Cancelling Unemployment Benefits
2223,politics,‘Shame on the Republican party’: GOP senators block Capitol riot commission
2224,politics,Sabato's Crystal Ball editor: Democrats could hold the Senate in midterms
2225,politics,Twitter fears for freedom of expression in India
2226,politics,"Niall Ferguson | Historian's Thoughts on Covid-19, Political Divisions &amp; The Next Catastrophe"
2227,politics,Senate's Capitol commission vote highlights Manchin's filibuster ignorance: The filibuster was never about helping pass good bills — only killing them. Why can't Joe Manchin see this?
2228,politics,Senator Schumer News Conference on January 6 Commission Vote | C-SPAN.org
2229,politics,"Senate Republicans Kill Bipartisan Jan. 6 Riot Commission | There were lots of excuses for why most Republicans blocked the commission, but they all boiled down to politics."
2230,politics,Senate Republicans block creation of US Capitol attack commission
2231,politics,Megathread: GOP Blocks Bipartisan Probe of Deadly Jan. 6 Riot at Capitol
2232,politics,New Bible that includes Constitution creates controversy before it even hits market
2233,politics,Video seems to contradict GOP politician who said he left Capitol before riot
2234,politics,BBC News: Republicans block 9/11-style congressional probe of Capitol riot
2235,politics,"Judge Approves Special Master, Denies Rudy Giuliani and Victoria Toensing’s Requests for Details of Government’s Probe"
2236,politics,Biden’s Justice Department Is Walking Into a Trap Set by Trump Appointees
2237,politics,These six Senate Republicans defied Trump to back Capitol riot commission
2238,politics,VIDEO: Ohio Police Laugh After Drag Queen Story Hour Supporter Waves Dildo At 13-Year-Old!
2239,politics,Senate Republicans block January 6 commission
2240,politics,Senate Republicans block January 6 commissio
2241,politics,Republicans Block Independent Commission to Investigate Attack on U.S. Capitol
2242,politics,Republicans Filibuster Bill Establishing Bipartisan Jan. 6 Commission
2243,politics,How an Accused Russian Agent Worked With Rudy Giuliani in a Plot Against the 2020 Election
2244,politics,Erneuerbare Energien Umfrage
2245,politics,Ep 160) The Left's Ideological Subversion Is A Multi-Layered Attack
2246,politics,Republicans block the creation of an independent inquiry into the Jan. 6 riot.
2247,politics,Pressed Down Shaken Together &amp; Running Over
2248,politics,USA FIRST WOMAN KAMALA HARRIS
2249,politics,Tesla Will Have to Ship Its Texas-Built Cars Out of State to Sell Back to Residents
2250,politics,Will rule of law succeed where Congress failed and hold Trump accountable?
2251,politics,Kinzinger slams Gaetz speech: 'This is why we need a January 6 commission'
2252,politics,"Khanna, Mace introduce bill to strengthen federal cyber workforce following major hacks"
2253,politics,"GOP senators block Jan. 6 Commission, likely ending bid for independent probe of Capitol riot"
2254,politics,SolarWinds hackers sent malware messages on 2020 election from U.S. agency email account
2255,politics,Krystal &amp; Saagar ending 'Rising'
2256,politics,Krystal and Saagar's last show
2257,politics,GOP senators block bill to create Capitol riot commission
2258,politics,Rising w/ Krystal &amp; Saagar is ending!?
2259,politics,McConnell to Trump: What’s a Little Insurrection Between Friends?
2260,politics,Republicans Block Creation of Independent Commission on Capitol Riot
2261,politics,Early voting for Virginia democratic primary outperforms 2017 numbers
2262,politics,Senate Republicans block January 6 commission
2263,politics,Senate Republicans block commission to study Capitol riot of January 6.
2264,politics,GOP Senators block jan 6 commission
2265,politics,Rep Gaetz Says Republicans Have An Obligation To Use Second Amendment For An Armed Rebellion
2266,politics,"Que peligroso que la 4T nos esté acostumbrando a su disparatado accionar, hace unos cuantos días compró la refinería Deer Park de Houston Tx. la cual para decirlo con todas sus letras es una ""Reverenda porquería"", es inaudita su capacidad de tomar malas decisiones, ahora bien para hacer sus"
2267,politics,History-Making Legislation To Repeal Marijuana Prohibition Reintroduced
2268,politics,Meghan McCain Slams Chris Cuomo's Nepotism
2269,politics,Bill To Restrict Transgender Students’ Bathroom Access Clears The Tennessee Senate | WPLN News - Nashville Public Radio
2270,politics,Senate Republicans Block Plan For Independent Commission On Jan. 6 Capitol Riot
2271,politics,GOP senators block bill to create Capitol riot commission
2272,politics,Senate Republicans Vote to STOP 1/6 Commission
2273,politics,Republicans block independent commission to investigate attack on U.S. Capitol
2274,politics,Senate Republicans filibuster Jan. 6 commission
2275,politics,"Republicans Tell Mom of Dead Capitol Officer to Shove It, Block January 6 Commission"
2276,politics,Republicans block the creation of an independent inquiry into the Jan. 6 riot
2277,politics,State of Missouri sues Kansas City Mayor Lucas over re-allocation of police funding
2278,politics,Senate Republicans Block Bill to Investigate Jan. 6 Capitol Riot
2279,politics,Senate Republicans block Jan. 6 commission to study Capitol insurrection
2280,politics,"[The Washington Post] GOP senators block Jan. 6 Commission, likely ending bid for independent probe of Capitol riot"
2281,politics,"GOP senators block Jan. 6 Commission, likely ending bid for independent probe of Capitol riot"
2282,politics,Caitlyn Jenner vows to 'cancel cancel culture' if elected as california governor
2283,politics,GOP blocks bipartisan probe of deadly Jan. 6 riot at Capitol
2284,politics,Biden doesn’t support broad student loan forgiveness. Advocates have a problem with his reason
2285,politics,Senate Republicans block January 6 commission
2286,politics,Chinese state media is turning on Fauci amid Wuhan lab controversy
2287,politics,Republicans Filibuster Bill Establishing Bipartisan Jan. 6 Commission
2288,politics,Harris becomes first woman to give commencement address at Naval Academy
2289,politics,Senate's Capitol commission fail highlights Manchin's filibuster ignorance
2290,politics,Senate Republicans filibuster Jan. 6 commission
2291,politics,'The truth is hard': Senate Republicans block commission to study Capitol riot of Jan. 6
2292,politics,"In opposing the Capitol riot commission, Sen. Mitch McConnell enables a cover-up"
2293,politics,Senate Republicans block bill to create commission to probe pro-Trump Capitol insurrection
2294,politics,Senate Republicans block January 6 commission
2295,politics,Caitlyn Jenner wows to 'cancel cancel cuture' if elected as california governor
2296,politics,MANDARAM FAZER UM OUTDOOR COM DINHEIRO PÚBLICO! PETISTA ACABA DE ATACAR ...
2297,politics,Senate reaches deal to vote on Jan. 6 commission and get out of town
2298,politics,Biden’s nominee for OSHA chief fights GOP for virus standards
2299,politics,Judge to appoint a ‘special master’ in Rudy Giuliani case
2300,politics,Election Audits Are Necessary in a Republic
2301,politics,U.S. to Freeze Funding for Ethiopia as Tigray Abuses Surface
2302,politics,Florida Social Media Censorship Law Touted by Gov. DeSantis Is a ‘Frontal Assault on the First Amendment’: Lawsuit
2303,politics,Exclusive: Michael Cohen tells Raw Story indictments are coming within 60 days in Trump criminal probe
2304,politics,Joe Biden Is Filling Top Pentagon Positions With Defense Contractors
2305,politics,Anti-Democratic Conservatism Isn’t New
2306,politics,Rudy Giuliani’s Actual Legal Defense: These Dems Are Peddling Conspiracies!
2307,politics,Why Are 34 States Ignoring a Law Designed to Make Your Road Trip Easier?
2308,politics,Judge orders special master to review Rudy Giuliani's electronic devices
2309,politics,Biden’s Fossil Fuel Moves Clash With Pledges on Climate Change
2310,politics,Gracie to Tel Aviv? Eric Adams says he wants retirement home in Israel
2311,politics,DANGERS and DANGERS USA look that vidéo
2312,politics,Pa. Sen. Doug Mastriano unlikely to face consequences over newly released Jan. 6 videos at the Capitol
2313,politics,Freedom Mask
2314,politics,Ohio lawmakers want to abolish vaccine requirements—all vaccine requirements
2315,politics,"Opinion: Mitch McConnell hits a new low, again. Yet Joe Manchin remains unmoved."
2316,politics,Analysis: Here’s What to Look For in Biden’s First Pentagon Budget Request | DOD likely to face fight from Congress on plans to divest older weapons.
2317,politics,Litigation Tracker: Pending Criminal and Civil Cases Against Donald Trump
2318,politics,Canada supports U.S. efforts to seek origins of COVID-19 -PM Trudeau
2319,politics,Ohio lawmakers want to abolish vaccine requirements—all vaccine requirements
2320,politics,Senate reaches deal to vote on Jan. 6 commission and get out of town
2321,politics,Eric Adams says he wants retirement home in Israel
2322,politics,Donald Trump Calls Paul Ryan 'a Curse' to Republicans After Ex-Speaker Urges GOP to Move in New Direction
2323,politics,EPW Committee Advances Surface Transportation Bill With Unanimous Support
2324,politics,Mitch McConnell Saw the Insurrection Clearly and Then Decided He Liked It
2325,politics,House Republicans demand congressional probe into COVID-19 origin
2326,politics,Polls find most Republicans say 2020 election was stolen and roughly one-quarter embrace QAnon conspiracies
2327,politics,"Biden’s Budget Sees Low Inflation, Rising Debt and Slow Economic Growth"
2328,politics,"Marjorie Taylor Greene tripled down on her Holocaust narrative, saying Nazis were the 'National Socialist party' of their time like the Democrats are now"
2329,politics,Watch live: Biden delivers remarks from Norfolk military base
2330,politics,'Paul Ryan has been a curse to the Republican Party': Donald Trump lashes out at former House Speaker after critical speech
2331,politics,"Kentucky foster agency says they’ll punish kids if they can’t discriminate against gay couples. Sunrise Children's Services is refusing to sign the state's standard contract unless they get a ""religious exemption"" to discriminate against gays, putting hundreds of kids at risk."
2332,politics,"Judge Approves Special Master, Denies Rudy Giuliani and Victoria Toensing’s Requests for Details of Government’s Probe"
2333,politics,Tech groups sue DeSantis over social media bill
2334,politics,Republican senators stall vote on January 6 comission
2335,politics,California Assembly bill aims to remove derogatory term ‘alien’ from state law
2336,politics,Biden was 'torn' about picking VP Harris after presidential debate 'bull---': book
2337,politics,Andrew Yang Doesn’t Know What He’s Talking About
2338,politics,How long will Trump remain immune?
2339,politics,Trump supporter screams racist &amp; antigay slurs at Joe Biden at ice cream shop
2340,politics,DENÚNCIA GRAVE! PEGARAM DE SURPRESA DIRIGENTE DE HOSPITAL! ADM NÃO SOUBE...
2341,politics,Biden administration plans to speed up court cases for migrant families
2342,politics,US Soldiers Expose Nuclear Weapons Secrets Via Flashcard Apps - bellingcat
2343,politics,A personal tale: honoring heroic Oakland battalion chief who died in 1991
2344,politics,Press admonished for fawning coverage of Biden ice cream pit stop: 'Our media is so embarrassing'
2345,politics,Voting Laws Roundup: May 2021 - States have already enacted more than 20 laws this year that will make it harder for Americans to vote — and many legislatures are still in session
2346,politics,Biden needles GOP touting rescue plan they opposed: 'Some people have no shame'
2347,politics,Is the Biden administration fueling a new Caucasus crisis?
2348,politics,Opinion | It's Time to Break Big Pharma's Grip on Healthcare and Empower Medicare to Negotiate Cheaper Drug Prices
2349,politics,"Rep. Matt Gaetz, fiancée claim money for St. Pete yacht deal ‘went missing’"
2350,politics,Can Removing Highways Fix America’s Cities?
2351,politics,Analysis: This is how dangerous right-wing media *actually* is
2352,politics,"Judge Approves Special Master, Denies Rudy Giuliani and Victoria Toensing’s Requests for Details of Government’s Probe"
2353,politics,"If this were true, why wouldn't Republicans want to investigate the January 6th insurrection?"
2354,politics,"How Harry Reid, a Terrorist Interrogator and the Singer From Blink-182 Took UFOs Mainstream - POLITICO"
2355,politics,Critical Race Theory Says Everything is Racist - Voddie Baucham
2356,politics,"OPINION: Police, massacres and social changes"
2357,politics,"""A new bargain"": Biden's 2024 tease"
2358,politics,Mother of fallen Capitol Police officer asks GOP senators to support January 6 commission but changes few minds
2359,politics,The Case for (and Against) a ‘Skinny’ Infrastructure Deal
2360,politics,The America of Tomorrow Could Use a 20th-Century Welfare State
2361,politics,Republicans Have a Good Reason Not to Want to Investigate Jan 6: They’re to Blame
2362,politics,Senate R&amp;D bill to counter China runs into GOP opposition
2363,politics,Chicago’s Mayor Lightfoot Promotes Racism
2364,politics,Federal judge to appoint special master to review materials seized from Giuliani
2365,politics,"Biden administration taking ""close look"" at vaccine passports for international travel"
2366,politics,Lightfoot Discriminated Against White Reporter By Not Granting Interview: Lawsuit
2367,politics,‘Bipartisan’ Is How Republicans Say ‘Sucker!’
2368,politics,"Montana AG says critical race theory, some antiracism programs taught in schools are 'discriminatory'"
2369,politics,"'Chaos, mayhem, frustration' on Capitol Hill as Senate GOP poised to block Jan. 6 commission"
2370,politics,"The “Steady Drumbeat” of Trump’s Big Lie May Stir More Attacks, a Federal Judge Says"
2371,politics,Dr. Anthony Fauci says he's 'not convinced' Covid-19 developed naturally - CNN Video
2372,politics,Poll: 73% of Republicans blame 'left-wing protesters' for Jan. 6 attack. Just 23% blame Trump.
2373,politics,Tech groups file federal lawsuit against Florida’s new social media law | Lawsuit alleges Florida legislation is a violation of free speech
2374,politics,Sheriff's deputy who posted anti-vaccine content dies of COVID
2375,politics,Does this mean I deserve a get out of Facebook jail free card?
2376,politics,Sheriff's Deputy Who Posted Anti-Vaccine Content Dies of COVID
